Project Name,Platform,Engine,Team Size,Role,Language,Duration,Description,Challenges,Process,Custom 1,Custom 2
Insomniac,PC,Unreal Engine 5,Solo,Solo,Blueprint,6 weeks,"Insomniac is a walking simulator set in a dystopian underground South Korean megastructure, featuring an abandoned apartment complex and subway system. The player navigates through a brutalist concrete world that stretches infinitely upward and downward into fog, collecting caffeine vitamins while exploring the grim remnants of a harsh work culture. The level emphasizes environmental storytelling through set dressing, lighting, and spatial design to communicate the oppressive nature of overwork and dependency.
This was the first project I developed during the Level Design course at the University of Utah (Jennifer Egan, Fall 2025). The assignment required visiting a real-world location in person, documenting it with photos and notes, and then creating a game level inspired by—but not directly copying—that space. I based my level on architecture and work culture observations from a South Korea visit during summer of the same year. Development ran for six weeks.","The assignment came with strict content and technical requirements:
- Must use flat colors only; no default Unreal textures or grids.
- No textured materials, including premade wood, stone, or leaves.
- Must not use the landscape tool (unless discussed with instructor).
- No high-poly or premade assets, including starter content.
- Level must be polished with no geometry/collision issues and no areas of complete darkness.
- Lighting pass required.
- Around 2-5 minutes of gameplay (excessively short levels would lose points).
- Must have functional collectibles.
- Cannot contain excessive platforming or require additional mechanics (like guns).
- Player cannot die, fall off edges, or have to restart.
- Must submit both video walkthrough and playable packaged build.

The focus was on how a space feels to walk through and whether it's interesting to look at, not player mechanics. Beyond jumping minimally, walking should be the only required mechanic.
My initial design challenge was handling tall apartment buildings—the higher the player climbs, the farther they can see, which could break immersion or reveal unfinished areas. To solve this, I shifted the setting to be dystopian and brutalist, taking the apartments underground into a vertical megastructure that uses fog to obscure the infinite pit above and below. This constrained the view while reinforcing the oppressive, liminal atmosphere.","I started by planning the general theme and world structure in-engine, prototyping how the player would traverse the space and designing the three main sections: the outside megastructure (bridges and the infinite pit), the apartment complex interior, and the subway station. The project required collectibles to guide the player, so I designed caffeine vitamin bottles with rotating animation and emissive materials to make them easily identifiable from a distance, even in darker areas.
Thematically, I leaned into South Korean work culture—long hours, competitive job markets, unhealthy stress, and widespread smoking as a coping mechanism. I pushed this further into environmental storytelling by making the world feel post-apocalyptic: run-down interiors, disorganized set dressing, broken/flickering lights, and knocked-over furniture. The dark gray concrete palette reinforced the brutalist aesthetic, while the vibrant emissive vitamins created intentional contrast—they represent the dependency on stimulants just to survive daily life in this grim world.
The player must collect at least 10 vitamins before entering the train at the end. Upon finishing, the level resets the player back to spawn with all vitamins respawned, creating a looping dream-like experience that suggests hallucination from overconsumption of caffeine.","World Setting & Theme

The dystopian underground megastructure is designed to feel infinite, oppressive, and liminal. The outer apartment walls stretch infinitely upward and downward into dense fog, obscuring the true scale and reinforcing the sense of being trapped in a concrete purgatory. The lack of sunlight and the grayscale color scheme (with sparse color highlights like the vitamins and flickering lights) create a suffocating, lifeless mood.

Long bridges connect different sections of the megastructure in non-structured, obscure placements, making the architecture feel dynamic and unstable. The broken bridge at the spawn area immediately teaches the player that not all paths are accessible, gently guiding navigation without explicit UI. Looking down from any bridge reveals the bottomless pit extending into darkness and fog, reinforcing scale and dread.

Inside the apartment complex and subway, environmental storytelling takes over. Stores are almost entirely empty, with shelves knocked over, mannequins tilted against walls or lying on the floor, and clothing racks disoriented. Broken and flickering lights add tension and visual interest while communicating neglect and decay. The women's bathroom is blocked off with traffic cones, implying it's out of order or unsafe. These small details—combined with the concrete brutalist construction—sell the idea of a society that has collapsed under the weight of overwork and unhealthy dependency on stimulants.

The caffeine vitamin bottles serve as both gameplay collectibles and thematic anchors. Their bright emissive glow contrasts sharply with the dark, lifeless world, symbolizing the only ""color"" or ""life"" left in this dystopia—artificial energy to keep people moving through an unbearable routine.","Level Design

The level is split into three main sections with deliberate pacing and navigation flow:

1. Outside Megastructure (Spawn & Bridges):  
The player spawns on the outer wall of the apartment complex at a three-way bridge intersection. One connection is completely broken, blocking that path and subtly guiding the player toward the correct route. The other connection leads across a long bridge to the center apartment building. Looking down reveals the infinite pit with fog obscuring the bottom, immediately establishing scale and tone. Looking up shows more apartment floors and bridges stretching into darkness and fog above. This opening moment sets the mood and teaches the player that exploration will be vertical and constrained by the megastructure's layout.

2. Center Apartment Complex (Interior & Staircase):  
Upon entering the center building via the bridge, the player finds a hallway with closed-off rooms except for one accessible room. At the center of the building is a staircase that allows vertical traversal. The upper staircase leads into darkness with an invisible barrier, gently signaling it's not the correct path. The player can explore 3-4 accessible floors, each reinforcing the abandoned, decayed aesthetic with minimal set dressing and strategic vitamin placement. Some vitamins are tucked around corners or behind walls, rewarding exploration.

When the player reaches the bottom floor and exits the building, they're greeted by another bridge leading directly to the subway entrance. This moment offers a final view of the megastructure—looking up at the liminal bridge placements and down into the bottomless pit—before transitioning into the subway section.

3. Subway Station (Final Section):  
The subway entrance descends via staircases into a main floor with three distinct areas: shops along the left wall, a ticketing area at the end, and large monitors (one broken and flickering) on the right wall. Each shop is sparse: shelves knocked over or tilted, clothing racks disoriented, and mannequins leaning or fallen. The third shop features a showcase window with a tilted mannequin and broken flickering light, reinforcing the decay theme.

The ticketing area includes two bathrooms—male and female—but the women's bathroom is blocked by traffic cones. The men's bathroom is small with a single stall. After passing through the ticketing area, the player descends another staircase to finally reach the train station platform. If the player has collected at least 10 vitamins, they can enter the train to finish the game. Upon completion, the level resets to the spawn point with all vitamins respawned, creating a looping, dream-like experience that suggests the entire journey was a caffeine-induced hallucination.

Navigation is entirely walk-based with minimal jumping required, keeping the focus on atmosphere, pacing, and environmental storytelling. The vitamin placement guides the player through key areas while rewarding those who explore thoroughly. The combination of vertical traversal, bridges, confined interiors, and the final subway descent creates a cohesive 2-5 minute experience that feels deliberate, oppressive, and thematically consistent."