Project Name,Platform,Engine,Team Size,Role,Language,Duration,Description,Challenges,Process,Custom 1,Custom 2
Ghost CTRL,PC,Unreal Engine 5,Solo,Solo,Blueprint,6 weeks,"Ghost CTRL is a solo Unreal Engine 5 prototype built as the final project for my Level Design course at the University of Utah (taught by Jennifer Egan), developed over six weeks and roughly 400 hours. It is a single‑player extraction shooter set in a compact modern city, where the player must locate a randomly spawned laptop, hold position to complete a 30‑second download, then navigate to a randomly spawned extraction point and survive the final countdown. The demo was scoped to satisfy strict course requirements while also serving as a recruitment‑ready pitch for my studio’s continuation project, Ghost Core.","Ghost CTRL was the final project for my Level Design course at the University of Utah, taught by Jennifer Egan, and the assignment came with a strict checklist. The requirements were:

- Create a primary mechanic beyond the default Unreal templates, built by me.
- Create a secondary, environment-based mechanic built by me.
- Do not use premade plugins or asset packs.
- Use flat colors only (no default Unreal textures or grids).
- Include SFX and background audio.
- Ensure player movement fits the level metrics.
- Deliver a polished level that runs at least 4–5 minutes.
- Avoid geometry/collision issues.
- Use good, attractive lighting and clear visual language.
- Provide a clear end goal and avoid the “floating in space” feel.
- Submit a playable package and a video.

I chose to exceed the course baseline by treating the project as a recruitment‑ready demo for my own studio (and the continuation project, Ghost Core), which raised the quality bar on systems, readability, and replayability. That scope had to fit into a six‑week schedule and roughly 400 hours of solo development time, which meant I had to prioritize systems that were both impressive and achievable, while also self‑teaching new areas like Unreal’s behavior tree + EQS and a pixel‑perfect ASCII UI pipeline without letting the level polish slip.","I structured the project around a single‑player extraction loop: explore the city, secure a randomly spawned laptop objective, complete a defend‑in‑place download timer, then locate a randomly spawned extraction point and survive the final countdown. The primary mechanic is gunplay, so I built two weapons from scratch (pistol and SMG) with custom ammo, reload, damage tuning, and knockback feedback, then wired their line‑trace hits into VFX. To make the loop playable and scalable beyond the course, I built a spawn manager system and designer‑facing spawner actors for enemies and loot, which let me control spawn rates and randomization while keeping the map replayable. Playtests exposed that the first pass was too punishing and unclear: players died often, struggled to locate the laptop objective, and felt like enemies were “sneaking up” on them. I iterated multiple times on difficulty by tuning enemy speed, health, and spawn rate, and I added visual behavior indicators to the enemies to communicate threat states and presence. The end result consistently ran longer than the 4–5 minute requirement, and the randomized objective and loot spawns created a new route and pacing on each run.","Level Design

The level is a compact, modern city inspired by Counter‑Strike layouts, built for readability and varied elevations rather than raw size. I designed a street grid with accessible first‑floor interiors, a sewer route, and a condensed rural edge to create vertical variation, alternate approaches, and overlapping sightlines without making the play space overwhelming. Because unique architecture is expensive in a six‑week solo build, I created a procedural building generator to populate the skyline and non‑playable zones; by constraining X, Y, and Z size ranges and randomizing window patterns, I could bake multiple building silhouettes quickly and use them as set dressing to avoid the unfinished “floating in space” feel. Objective placement was deliberate: laptop spawners encourage exploration of multiple zones, while download locations are chosen for defendability and sightline control, and extraction points are placed to make the final sprint tense without being unfair. Lighting and color were kept clean and purposeful to maintain a consistent visual language and guide the player toward goals and routes.","System and UI

Enemies are hacked synthetic humans (“synths”) driven by a behavior tree and EQS. They have four readable states, each signaled by a spotlight color: red for active chase via sight, orange for investigating last‑seen position, yellow for sound‑based investigation (gunfire has distinct hearing ranges), and blue for passive roaming. EQS lets them search blind spots around the last‑seen area rather than beelining unrealistically, and the light system both communicates intent and prevents players from feeling blindsided. Combat includes locational damage multipliers (headshots at 2x, limb hits at 0.5x) and knockback so each weapon feels distinct and rewards precision. The objective system uses randomized laptop and extraction spawns, with a 30‑second “stay‑in‑zone” download timer that forces area defense, followed by a separate 30‑second extraction timer that allows free movement. The UI is built entirely with a CP437 monospaced ASCII typeface, which required careful pixel‑perfect setup to avoid artifacting. I used ASCII borders and bars for health and stamina, a Blueprint‑driven event log for loot, damage, and objective changes, and a four‑step objective tracker that communicates the loop clearly: Find Lost Data, Download Data, Head to Extraction, and Extract."
Final Shot,PC,Unreal Engine 5,Solo,Solo,Blueprint,48 hours,"Final Shot is a solo Unreal Engine 5 mage arena shooter built in 48 hours for the Introduction to Game Scripting final at the University of Utah. It delivers the required two-level structure (practice range and showdown) and expands it with a full menu flow, a victory loop, resource-driven combat (health, stamina, mana), and a stylized presentation centered on spellcasting and readable combat feedback.","Final Shot was built for a tightly scoped class brief that defined the game loop, UI, and progression rules up front, and I chose to exceed that scope while finishing in 48 hours. The hard part was hitting every required behavior (level progression, health rules, UI counts, and enemy patterning) and still leaving time for polish, animation, and VFX without breaking the spec or flow. The assignment checklist was:

- Build a player character that can shoot bullets.
- Include two levels: a shooting range and a showdown.
- In the range, hit five targets with a visible target count; clear all to advance.
- In the showdown, fight an enemy that cycles three fixed locations and shoots at the player.
- Both player and enemy use three-hit health rules; player death restarts the level and enemy death ends the game.
- UI must show targets destroyed/remaining, player health, and enemy health when present.
- Include a bullet actor with projectile movement, hit logic, and distinct fire/impact audio.
- Use required blueprints and input mapping (shoot input with a one-second cooldown).","I implemented the core systems in Blueprint: a shoot input with cooldown, a bullet actor with projectile movement and hit logic, a target actor that increments a target counter, and an enemy AI that cycles fixed positions and fires at the player. The UI covers target counts, player/enemy health, and win/lose messaging. Beyond the base spec, I added a main menu with level selection, a charged fireball that scales size and damage over a three-second charge, and expanded the showdown into a four-mage fight with ice projectiles and a victory return to the main menu.","Level Design

The Target Range is a small forest practice area blocked out with the landscape tool and asset-bashed trees and stone surfaces. I built a target tool that moves targets along spline paths or lifts them on a wooden plank, and once 10 targets are destroyed a portal gate rises to load the Battle Arena. The Battle Arena is a Roman colosseum-inspired pit with a spectator ring, pillars, boulders, and four entrances where AI mages spawn. Both levels share a pickup-pad tool that periodically spawns mana crystals or health potions based on an exposed chance value.","Tech Art and Animation

I retargeted Mixamo animations and blended the firing animation with idle/run so casting reads during movement. Timelines synchronize VFX and SFX with casting, release, and impact. Fireball and iceball effects are built in three stages (hand hold, projectile flight, impact) with layered emitters, and I created a custom cel shader using luminance thresholds to tune the stylized lighting."
Rogue Data,PC,Unreal Engine 5,Solo,Solo,Blueprint,6 weeks,"Rogue Data is a solo 2D side-scroller built for the second Level Design assignment (Jennifer Egan, University of Utah) over four weeks. It follows a glitched AI fragment navigating the backend of a system, and it focuses on momentum movement, an energy-driven ability set, and a color-coded hub that teaches and tests mastery while supporting the narrative.","The brief required a tutorial that explicitly teaches controls and strict content limits, so I had to balance clarity, movement feel, and visual identity within a short timeline. The assignment checklist was:

- Tutorials/teaching the player how to play and use your mechanics key bindings.
- Tell the player what the keybindings are, even if it's obvious.
- Only use flat colors; no default Unreal textures/grids.
- Include SFX and background audio (ambience/music).
- Include a player mechanic beyond jumping (dash, wall jump, etc.).
- Include environmental mechanics or hazards.
- Player movement must fit the level metrics.
- No high-poly or premade assets/textures.
- Player and level reset correctly on death/fail.
- Polished level with no geometry/collision issues.
- Good, attractive lighting and clear end/goal.
- Video and packaged build attached; package is playable.

I also wanted the project to feel intentional despite my initial lack of excitement about making a 2D platformer, so I focused on movement feel, clear teaching, and a readable visual language.","I front-loaded time on visuals and mechanics so I could focus on level design later. The player has walljump, dash, and cursor-drag abilities; dash and drag consume a shared energy bar that only recharges on the ground. Dash spends all remaining energy to determine distance, while drag drains at a steady rate until the object is released or energy is empty. I iterated on movement feel through playtests, and I used on-screen keybinding prompts to ensure the tutorial taught controls clearly.","Level Design

The tutorial uses bright white with CMYK accents to create a diagnostic feel, then a locked-room sequence with a broken teleport timer shifts the game into a dark RGB/black “glitched” world. A buffer climb area of loose, falling-apart platforms introduces higher difficulty before the main hub. The hub centers on three colored pads (blue puzzle, green accuracy, red speed) and key collection; the puzzle section was scoped out, so its key sits nearby to teach the hub mechanic. The accuracy route uses emissive arrow boosters that push the player off the intended path, forcing precision; the key must then be dragged back to the hub. The speed route uses red dissolving platforms that respawn after a delay, limiting energy recharge and forcing smart dash timing with rest platforms between sections. The ending resolves with a bright light and gravity reversal that lifts the player upward.","Technical Art

The player character is a Niagara voxel build made by sampling the Quinn skeletal mesh and placing evenly spaced emissive cubes. The energy bar shifts from green to red, and the voxel body fades from the bottom up as energy drains, letting players read energy without staring at the UI. I leaned on flat colors, emissive accents, and audio to reinforce the diagnostic-to-glitch transition, and playtests confirmed the emissive language improved readability."
METACONSTRUCT,PC,Unreal Engine 5,5,Producer,Blueprint,14 weeks,"METACONSTRUCT is a single‑player first‑person looter shooter set inside a decaying digital construct corrupted by an unknown anomaly. Players scavenge for resources, fight through hostile entities, and extract before the corruption overtakes them. The original pitch emphasized randomized layouts, extraction points, and enemy spawns, a liminal concrete environment, and a low‑poly, PS2‑era aesthetic. The final build scoped down from that vision due to team size and time constraints, but retained the core identity: a survival‑focused shooter with procedural elements and a digital, unstable world.

This project was selected from roughly 30 class pitches and developed over a four‑month semester in the University of Utah’s Traditional Game Development course (Michael Caldwell). I led a team of five, serving as the project’s producer and also covering level design and technical art to fill missing roles.","The biggest constraint was team size. We lacked key roles (producer, texture artist, tech/VFX, SFX, UI/UX), so I had to stretch across production, level design, and technical art while keeping the team aligned with a reduced scope. Visually, we had to build identity without a dedicated texture artist, which pushed us toward flat materials and stronger post‑processing to sell the digital decay. Technically, it was my first time implementing PCG workflows, procedural mesh generation in Unreal, and advanced post‑process effects (fog‑of‑war, stylized reveal, vertex snapping). Balancing these first‑time systems with a playable, coherent build was the core challenge.","I started from the approved pitch and aligned the team around a scoped‑down but cohesive feature set. As producer, I handled planning, task coordination, and milestone tracking while making sure design goals remained feasible for a small team. We chose a flat‑color material approach for speed, supplemented by post‑process effects to communicate the digital theme. We also leveraged a university SFX library rather than custom sound work to stay on schedule.

On the technical side, I built the procedural systems, fog‑of‑war pipeline, and visual effects while coordinating asset needs with our artists. Toward the end, I directed the main menu scene’s visual direction (Matrix‑inspired), managed the environment setup (lighting, camera, asset placement), and collaborated with a teammate who implemented UI functionality. The final build reflects a tight, cohesive slice of the original concept, with production lessons and technical growth as the main outcomes.","Procedural Generation

I created procedural dust set dressing and hazards using Perlin noise in Unreal Engine. A Marketplace Perlin node gave me noise values, but I still had to build the mesh generation pipeline: plotting vertices across a grid, triangulating them into rectangles, and stitching the triangles into a dynamic plane mesh. I exposed frequency, magnitude, size, and UV scale to tune the visuals and used a shared randomized seed to keep all procedural systems consistent. This same approach powered a rising hazard variant to reinforce the unstable, corrupting world.

I also taught myself Unreal’s PCG workflow to scatter meshes across sampled positions. Because we lacked custom building assets, I used free building meshes and synced PCG generation to the same seed managed by a level blueprint. This ensured that environmental placement, noise‑based set dressing, and hazards all aligned on a consistent procedural state.","Technical Art

The signature system was a fog‑of‑war for a first‑person shooter. I built a 1:10 scale proxy of the level off to the side and created a brush blueprint that mirrored player movement into this smaller space. A render target and dynamic material painted the brush into a mask (white = revealed, black = hidden). The post‑process then used that mask to reveal the world, blending a digital grid transition created with UV channel splits (R/G/B as axis offsets), smoothstep, and dithering. I used custom stencil filtering so the effect applied only where intended, keeping the reveal clean and readable.

I also implemented a screen‑space vertex snapping post‑process inspired by PSX‑era rendering limitations. Rather than applying it globally, I limited it to enemy models to make them feel like unstable digital artifacts. Combined with the fog‑of‑war and flat‑color palette, the effect reinforced the project’s identity despite the scoped‑down asset pipeline."
Tiny Sheriff,PC,Unity,25,"Programmer, VFX/Tech Artist",C#,9 months (2 semesters),"Tiny Sheriff is a 2D movement platformer where weapons are traversal tools. Each shot propels the player through the air, enabling dash, double‑jump, and wall‑bounce movement while keeping combat fast, chaotic, and momentum‑driven. Enemies and hazards (including cacti) force precise control—mistimed shots can launch the player into danger, so movement mastery is the core skill.

The project was developed as part of the University of Utah Division of Games Capstone, a two‑semester, industry‑modeled course where teams build a full game from the ground up. I joined the Tiny Sheriff team after the project was selected into the final set of capstone games and after an early demo had already established three weapons (double‑barrel shotgun, harpoon, and SMG prototype).","I joined an existing prototype that relied heavily on Unity’s default functions and hard‑coded logic, which created timing bugs (weapon swapping, execution order) and made progression systems harder to manage. Movement also mixed Translate and velocity‑based motion, which broke momentum consistency—especially for a game where knock‑back movement is the core mechanic.

In Capstone 2, I transitioned from engineering to technical art, which meant building VFX and shader work in Unity for the first time while still supporting gameplay implementation. The challenge was shipping production‑ready visuals that level designers could use without specialized setup.","

During Capstone 1, I focused on stabilizing systems and re‑architecting player movement. I converted the codebase from scattered, hard‑coded actions to a unified event‑based approach so gameplay systems could trigger in a controlled, predictable order. This also unlocked better ammo handling and progression logic (weapon unlocks vs. full access in the prototype).

In Capstone 2, after planning and design meetings for the next level set, I pitched the wind mechanic and helped implement it both technically and visually. I then shifted toward technical art to raise visual quality, building reusable effects that were easy for designers to drop into levels.","Engineering

I replaced the prototype’s mixed movement approach with a velocity‑only system. This preserved knock‑back momentum, aligned better with weapon propulsion, and enabled the wind mechanic to work consistently.

I also reworked the project into an event‑driven architecture. A shared event handler and manager tracked event order and execution timing, which fixed critical issues like weapon swapping and action sequencing. This structure made it easier to manage ammo logic and lock/unlock weapons as part of game progression.","Technical Art

I built a wind particle system designed for designers. The effect exposed adjustable range controls to match the gameplay wind trigger zones, making it easy to tune visuals to mechanics. I also collaborated on the implementation side by exposing velocity parameters that designers could manipulate.

To push atmosphere, I created a heat‑wave background effect using Unity’s Shader Graph. By combining time‑based sine waves across multiple channels, I achieved a shimmering haze that reads as hot air distortion. Like the wind VFX, the heat‑wave was packaged as a prefab so designers could place and scale it without technical setup."
Project Quiver,PC,Unreal Engine 5,3,"Producer, Programmer, Tech Artist","Blueprint, C++",On-going (January 2026),"Project Quiver is a multiplayer, movement‑driven PvP roguelike inspired by Rounds, built in a 3D third‑person fantasy RPG style around One‑In‑The‑Quiver gameplay. Each player has three arrows and can recover them after shots; melee attacks offer a high‑risk option that also adds momentum. Movement is the core of skill expression—slides, wall slides, and wall jumps are chained together, and melee strikes provide additional directional burst. The entire system is velocity‑based, letting players maintain or build speed through advanced movement combos while fighting across a procedurally generated, tile‑based arena.

This is my second out‑of‑school project with a small team, targeting eventual release on Steam and Itch.io. We’re currently in a polished prototype phase before expanding the team for full production.","The prototype required three complex systems to work together: tile‑based procedural generation, a deep ability‑driven movement framework, and networked multiplayer synchronization. Each area had steep learning curves and hard technical constraints. I had not previously implemented Unreal’s Gameplay Ability System (GAS) or Unreal C++ workflows, and multiplayer movement introduces prediction, rollback risk, and replication accuracy issues—especially once movement goes beyond basic locomotion.

On top of that, procedural generation needed to be deterministic across server and clients, which meant syncing seeded generation while keeping the system scalable and clean enough to iterate on quickly.","I structured the prototype around three pillars: generation, movement abilities, and multiplayer networking. I built the tile system first to lock in repeatable arenas, then layered movement as GAS abilities so it could scale into future roguelike items and stat modifiers. Finally, I focused on replication and prediction for smooth online play, using Unreal’s replication framework and Advanced Sessions to validate Steam networking.

Throughout development, I pushed toward deterministic behavior (seeded generation) and authoritative networking, while keeping the movement feel responsive and momentum‑driven on the client.","Procedural Generation

The arena is built from a deterministic tile‑grid system that supports multiple tile sizes (1x1, 2x1, 2x2) and generates layouts in three passes. First, the generator frames the outer boundary using larger tile sizes, intentionally leaving gaps for variation. Second, it fills the interior with non‑standard tiles while still preserving pockets of space. Third, it backfills all remaining gaps—including wall pieces—using 1x1 tiles. This results in a fully closed arena with mixed tile sizes that feel structured but varied.

The system is scalable by design: the map size is adjustable (minimum 3x3), and the generator uses a shared stream seed so the same seed always produces the same level. That seed is synchronized between server and clients so procedural generation is identical across the network, ensuring all players see and collide with the same tile layout every round.

Because this is a multiplayer PvP game, deterministic generation isn’t just a convenience—it’s required. If even one tile differed between host and client, movement, collision, and line‑of‑sight could desync. The seeded approach guarantees consistency while still allowing replayable variation and player‑selected map seeds for repeatable matches.","Gameplay Ability System (GAS)

I implemented player movement as GAS abilities so it can scale with roguelike items and stats later (e.g., buffs, cooldowns, modifiers). This includes slide, wall slide, wall jump, and melee momentum, all of which are velocity‑driven and designed to chain together for advanced movement expression.

GAS also solves a core multiplayer problem: advanced movement prediction. In Unreal, clients must feel responsive, so movement is client‑authored and server‑validated. Basic locomotion prediction is built‑in, but once movement involves custom abilities (wall slide timing, slide friction, melee impulse), prediction needs to be more precise to avoid rollback or jitter. GAS provides stronger prediction hooks and a cleaner replication model for ability‑driven actions, which lets me keep movement responsive on the client while still maintaining server authority.

This system is implemented in C++, which meant learning both the GAS C++ API and Unreal’s C++ gameplay framework for the first time. The benefit is deeper control over ability activation, prediction windows, and replication rules—critical for a fast, momentum‑based PvP game. I also used Unreal’s replication system to sync physics arrows so projectile behavior stays consistent across host and clients."
